{
  "$schema": "../schemas/plugin.schema.json",
  "id": "cssharp-store",
  "enabled": true,
  "autoUpdate": true,
  "repository": {
    "type": "github",
    "owner": "Cruze03",
    "repo": "CS2-Store",
    "releaseType": "latest"
  },
  "downloadPattern": "Store.zip",
  "metadata": {
    "name": "CS# Store",
    "descriptionZh": "CS2 商店系统插件，支持积分购买装备和道具",
    "category": "gameplay",
    "tags": ["store", "credits", "shop", "economy"],
    "framework": "counterstrikesharp",
    "featured": true
  },
  "installation": {
    "type": "extract",
    "targetPath": "game/csgo/addons/counterstrikesharp/plugins",
    "files": ["Store/*"]
  },
  "verification": {
    "method": "github-verified",
    "verifiedBy": "csp2-team",
    "verifiedAt": "2025-10-27T00:00:00Z",
    "notes": "Popular economy plugin with modular system"
  }
}

